{
  "schema_version": 1,
  "catalog_sha256": "72c849825c9cbd39cb25f743d448b67a2a31bfccf7cfb68a3d2557c7bda178bf",
  "integration_sha": null,
  "rows": [
    {
      "catalog_id": "FPMS-V8-MANIFEST-RELEASE-GATE-20260712-01",
      "phase": "foundation",
      "disposition": "SUPERSEDED_BY_STORY",
      "story_id": null,
      "successor_story_id": "C3-LEAN-GOVERNANCE-ADOPTION",
      "blocker": null
    },
    {
      "catalog_id": "FPMS-V8-CATALOG-MANIFEST-COVERAGE-GATE-20260712-01",
      "phase": "foundation",
      "disposition": "SUPERSEDED_BY_STORY",
      "story_id": null,
      "successor_story_id": "C3-LEAN-LEDGER-INTEGRATION-REF-CORRECTION",
      "blocker": null
    },
    {
      "catalog_id": "FPMS-V8-W1-L1-CASE-LIFECYCLE-PROJECTION-CARRIER-20260712-01",
      "phase": "foundation",
      "disposition": "SUPERSEDED_BY_STORY",
      "story_id": null,
      "successor_story_id": "V8-CANARY-LIFECYCLE-CORE-EVIDENCE-KIND-ADOPTION",
      "blocker": null
    },
    {
      "catalog_id": "FPMS-V8-W1-L2-CASE-ACTIVITY-EVENT-CARRIER-20260712-01",
      "phase": "foundation",
      "disposition": "SUPERSEDED_BY_STORY",
      "story_id": null,
      "successor_story_id": "V8-CANARY-LIFECYCLE-CORE-EVIDENCE-KIND-ADOPTION",
      "blocker": null
    },
    {
      "catalog_id": "FPMS-V8-W1-L3-CASE-ACTIVITY-EVIDENCE-CARRIER-20260712-01",
      "phase": "foundation",
      "disposition": "SUPERSEDED_BY_STORY",
      "story_id": null,
      "successor_story_id": "V8-CANARY-LIFECYCLE-CORE-EVIDENCE-KIND-ADOPTION",
      "blocker": null
    },
    {
      "catalog_id": "FPMS-V8-W1-D1-DOCUMENT-EVIDENCE-VERSION-CARRIER-20260712-01",
      "phase": "foundation",
      "disposition": "CURRENT_VERIFIED",
      "story_id": "V8-CANARY-SCHEMA-SPINE-CURRENT-VERIFICATION",
      "successor_story_id": null,
      "blocker": null
    },
    {
      "catalog_id": "FPMS-V8-W1-D2-DOCUMENT-EVIDENCE-DERIVATION-CARRIER-20260712-01",
      "phase": "foundation",
      "disposition": "CURRENT_VERIFIED",
      "story_id": "V8-CANARY-SCHEMA-SPINE-CURRENT-VERIFICATION",
      "successor_story_id": null,
      "blocker": null
    },
    {
      "catalog_id": "FPMS-V8-W1-D3-WORK-PACKAGE-EVIDENCE-LINK-CARRIER-20260712-01",
      "phase": "foundation",
      "disposition": "CURRENT_VERIFIED",
      "story_id": "V8-CANARY-SCHEMA-SPINE-CURRENT-VERIFICATION",
      "successor_story_id": null,
      "blocker": null
    },
    {
      "catalog_id": "FPMS-V8-W1-F1-FEE-OBLIGATION-CARRIER-20260712-01",
      "phase": "foundation",
      "disposition": "CURRENT_VERIFIED",
      "story_id": "V8-CANARY-SCHEMA-SPINE-CURRENT-VERIFICATION",
      "successor_story_id": null,
      "blocker": null
    },
    {
      "catalog_id": "FPMS-V8-W1-F2-FEE-OBLIGATION-LINE-CARRIER-20260712-01",
      "phase": "foundation",
      "disposition": "CURRENT_VERIFIED",
      "story_id": "V8-CANARY-SCHEMA-SPINE-CURRENT-VERIFICATION",
      "successor_story_id": null,
      "blocker": null
    },
    {
      "catalog_id": "FPMS-V8-W1-F3-OBLIGATION-DRAFT-LINK-CARRIER-20260712-01",
      "phase": "foundation",
      "disposition": "CURRENT_VERIFIED",
      "story_id": "V8-CANARY-SCHEMA-SPINE-CURRENT-VERIFICATION",
      "successor_story_id": null,
      "blocker": null
    },
    {
      "catalog_id": "FPMS-V8-W1-F4-OBLIGATION-PAYMENT-EVIDENCE-LINK-CARRIER-20260712-01",
      "phase": "foundation",
      "disposition": "CURRENT_VERIFIED",
      "story_id": "V8-CANARY-SCHEMA-SPINE-CURRENT-VERIFICATION",
      "successor_story_id": null,
      "blocker": null
    },
    {
      "catalog_id": "FPMS-V8-W1-F5-FEE-REDUCTION-APPROVAL-CARRIER-20260712-01",
      "phase": "foundation",
      "disposition": "CURRENT_VERIFIED",
      "story_id": "V8-CANARY-SCHEMA-SPINE-CURRENT-VERIFICATION",
      "successor_story_id": null,
      "blocker": null
    },
    {
      "catalog_id": "FPMS-V8-LC-CONTRACTS-20260712-01",
      "phase": "foundation",
      "disposition": "CURRENT_VERIFIED",
      "story_id": "V8-CANARY-LIFECYCLE-CORE-EVIDENCE-KIND-ADOPTION",
      "successor_story_id": null,
      "blocker": null
    },
    {
      "catalog_id": "FPMS-V8-LC-ACTIVITY-APPEND-20260712-01",
      "phase": "foundation",
      "disposition": "CURRENT_VERIFIED",
      "story_id": "V8-CANARY-LIFECYCLE-CORE-EVIDENCE-KIND-ADOPTION",
      "successor_story_id": null,
      "blocker": null
    },
    {
      "catalog_id": "FPMS-V8-LC-LEGACY-PROJECTION-20260712-01",
      "phase": "foundation",
      "disposition": "CURRENT_VERIFIED",
      "story_id": "V8-CANARY-LIFECYCLE-CORE-EVIDENCE-KIND-ADOPTION",
      "successor_story_id": null,
      "blocker": null
    },
    {
      "catalog_id": "FPMS-V8-LC-APPLY-EVENT-SEAM-20260712-01",
      "phase": "foundation",
      "disposition": "CURRENT_VERIFIED",
      "story_id": "V8-CANARY-LIFECYCLE-CORE-EVIDENCE-KIND-ADOPTION",
      "successor_story_id": null,
      "blocker": null
    },
    {
      "catalog_id": "FPMS-V8-LC-CASE-OPENED-20260712-01",
      "phase": "foundation",
      "disposition": "CURRENT_VERIFIED",
      "story_id": "V8-CANARY-CASE-STATUS-UI-VERTICAL-CURRENT-VERIFICATION",
      "successor_story_id": null,
      "blocker": null
    },
    {
      "catalog_id": "FPMS-V8-LC-FILING-PREPARATION-STARTED-20260712-01",
      "phase": "foundation",
      "disposition": "PENDING",
      "story_id": null,
      "successor_story_id": null,
      "blocker": null
    },
    {
      "catalog_id": "FPMS-V8-LC-FILING-EXTERNAL-SUBMISSION-RECORDED-20260712-01",
      "phase": "foundation",
      "disposition": "PENDING",
      "story_id": null,
      "successor_story_id": null,
      "blocker": null
    },
    {
      "catalog_id": "FPMS-V8-LC-FILING-RECEIPT-ARCHIVED-20260712-01",
      "phase": "foundation",
      "disposition": "PENDING",
      "story_id": null,
      "successor_story_id": null,
      "blocker": null
    },
    {
      "catalog_id": "FPMS-V8-LC-ACCEPTANCE-NOTICE-RECORDED-20260712-01",
      "phase": "foundation",
      "disposition": "HISTORICAL_PASS_CANDIDATE",
      "story_id": null,
      "successor_story_id": null,
      "blocker": null
    },
    {
      "catalog_id": "FPMS-V8-LC-PRELIMINARY-EXAMINATION-STARTED-20260712-01",
      "phase": "foundation",
      "disposition": "HISTORICAL_PASS_CANDIDATE",
      "story_id": null,
      "successor_story_id": null,
      "blocker": null
    },
    {
      "catalog_id": "FPMS-V8-LC-PRELIMINARY-EXAMINATION-PASSED-20260712-01",
      "phase": "foundation",
      "disposition": "HISTORICAL_PASS_CANDIDATE",
      "story_id": null,
      "successor_story_id": null,
      "blocker": null
    },
    {
      "catalog_id": "FPMS-V8-LC-RECTIFICATION-NOTICE-RECORDED-20260712-01",
      "phase": "foundation",
      "disposition": "HISTORICAL_PASS_CANDIDATE",
      "story_id": null,
      "successor_story_id": null,
      "blocker": null
    },
    {
      "catalog_id": "FPMS-V8-LC-PUBLICATION-NOTICE-RECORDED-20260712-01",
      "phase": "foundation",
      "disposition": "HISTORICAL_PASS_CANDIDATE",
      "story_id": null,
      "successor_story_id": null,
      "blocker": null
    },
    {
      "catalog_id": "FPMS-V8-LC-SUBSTANTIVE-EXAMINATION-STARTED-20260712-01",
      "phase": "foundation",
      "disposition": "HISTORICAL_PASS_CANDIDATE",
      "story_id": null,
      "successor_story_id": null,
      "blocker": null
    },
    {
      "catalog_id": "FPMS-V8-LC-OA-NOTICE-RECORDED-20260712-01",
      "phase": "foundation",
      "disposition": "HISTORICAL_PASS_CANDIDATE",
      "story_id": null,
      "successor_story_id": null,
      "blocker": null
    },
    {
      "catalog_id": "FPMS-V8-LC-OA-RECEIPT-ARCHIVED-20260712-01",
      "phase": "foundation",
      "disposition": "HISTORICAL_PASS_CANDIDATE",
      "story_id": null,
      "successor_story_id": null,
      "blocker": null
    },
    {
      "catalog_id": "FPMS-V8-LC-REEXAMINATION-STARTED-20260712-01",
      "phase": "foundation",
      "disposition": "HISTORICAL_PASS_CANDIDATE",
      "story_id": null,
      "successor_story_id": null,
      "blocker": null
    },
    {
      "catalog_id": "FPMS-V8-LC-GRANT-REGISTRATION-NOTICE-RECORDED-20260712-01",
      "phase": "foundation",
      "disposition": "HISTORICAL_PASS_CANDIDATE",
      "story_id": null,
      "successor_story_id": null,
      "blocker": null
    },
    {
      "catalog_id": "FPMS-V8-LC-GRANT-ANNOUNCEMENT-CONFIRMED-20260712-01",
      "phase": "foundation",
      "disposition": "HISTORICAL_PASS_CANDIDATE",
      "story_id": null,
      "successor_story_id": null,
      "blocker": null
    },
    {
      "catalog_id": "FPMS-V8-LC-PATENT-REGISTER-STATUS-CONFIRMED-20260712-01",
      "phase": "foundation",
      "disposition": "HISTORICAL_PASS_CANDIDATE",
      "story_id": null,
      "successor_story_id": null,
      "blocker": null
    },
    {
      "catalog_id": "FPMS-V8-LC-APPLICATION-REJECTION-CONFIRMED-20260712-01",
      "phase": "foundation",
      "disposition": "HISTORICAL_PASS_CANDIDATE",
      "story_id": null,
      "successor_story_id": null,
      "blocker": null
    },
    {
      "catalog_id": "FPMS-V8-LC-APPLICATION-WITHDRAWAL-CONFIRMED-20260712-01",
      "phase": "foundation",
      "disposition": "PENDING",
      "story_id": null,
      "successor_story_id": null,
      "blocker": null
    },
    {
      "catalog_id": "FPMS-V8-LC-APPLICATION-ABANDONMENT-CONFIRMED-20260712-01",
      "phase": "foundation",
      "disposition": "PENDING",
      "story_id": null,
      "successor_story_id": null,
      "blocker": null
    },
    {
      "catalog_id": "FPMS-V8-LC-PATENT-TERMINATION-CONFIRMED-20260712-01",
      "phase": "foundation",
      "disposition": "PENDING",
      "story_id": null,
      "successor_story_id": null,
      "blocker": null
    },
    {
      "catalog_id": "FPMS-V8-LC-PATENT-EXPIRY-CONFIRMED-20260712-01",
      "phase": "foundation",
      "disposition": "PENDING",
      "story_id": null,
      "successor_story_id": null,
      "blocker": null